{"type":"config","name":"Feishu search latency optimization","metricName":"verification_runtime","metricUnit":"s","bestDirection":"lower"}
{"run":1,"commit":"a226c70","metric":15.8,"metrics":{"tests_passed":208,"test_files_passed":28},"status":"keep","description":"Implemented Convex customer/coworker search latency improvements and verified gates plus experiment harness help","timestamp":1780244410471,"segment":0,"confidence":null,"asi":{"hypothesis":"Server-indexed customer search latency improves by avoiding no-op mirror writes, while coworker perceived latency improves through validated Convex cache plus frontend in-flight/TTL cache; docs and a guarded experiment harness make continued measurement repeatable.","verification":"bun run typecheck && bun run lint && bun run test && bun run search:experiment -- --help passed in run_experiment.","caveat":"Live destructive Convex latency experiment was not run; harness requires --destructive-ok and a disposable/dev deployment because it replaces customers, coworkerSearchCache, and feishuUserTokens."}}
{"type":"config","name":"Coworker warm-cache latency path optimization","metricName":"warm_cache_remote_calls","metricUnit":"","bestDirection":"lower"}
{"run":2,"commit":"234a7ed","metric":0,"metrics":{"targeted_tests_passed":18,"full_tests_passed":210},"status":"keep","description":"Route warm coworker cache hits through a public Convex query before action fallback","timestamp":1780244976967,"segment":1,"confidence":null,"asi":{"hypothesis":"Warm coworker/contact search cache hits should avoid both Feishu calls and Convex action runtime by checking a session-validated public Convex query before falling back to the existing action.","verification":"run_experiment passed targeted coworker hook/server cache tests plus typecheck/lint with METRIC warm_cache_remote_calls=0; separate full suite passed 28 files / 210 tests and search:experiment help still works.","anti_overfit":"The test asserts behavior at the API boundary (no action call on warm query cache hit) rather than hardcoding benchmark internals; Feishu remains source of truth on cold/stale cache misses.","caveat":"Live destructive Convex p50/p95 experiment was not run because it requires --destructive-ok on a disposable/dev deployment."}}
{"type":"config","name":"Customer mirror refresh kick throttling","metricName":"mirror_refresh_actions","metricUnit":"","bestDirection":"lower"}
{"run":3,"commit":"239986e","metric":1,"metrics":{"targeted_tests_passed":1,"full_tests_passed":211,"full_test_files_passed":29},"status":"keep","description":"Throttle on-search Customer Mirror full refresh kicks","timestamp":1780245169045,"segment":2,"confidence":null,"asi":{"hypothesis":"Repeated CustomerPicker opens can enqueue redundant full Customer Mirror refresh actions; throttling on-search kick to once per taskpane session every 15 minutes reduces Convex action load and Feishu records/search traffic without weakening query correctness because cache-miss backfill remains the per-query freshness path.","verification":"run_experiment passed new hook test plus typecheck/lint with METRIC mirror_refresh_actions=1 for two rapid triggerRefresh calls; separate full suite passed 29 files / 211 tests and search:experiment help still works.","anti_overfit":"The test checks the user-flow behavior (two rapid picker refresh triggers cause one kick action) rather than depending on implementation timing internals; no benchmark shortcuts or fake Feishu search results were added.","caveat":"This is a cost/latency-load reduction for repeated UI refresh triggers, not a live p50/p95 deployment measurement. Live destructive Convex experiment still requires --destructive-ok on a disposable/dev deployment."}}
{"type":"config","name":"Customer server-index duplicate query coalescing","metricName":"customer_duplicate_remote_calls","metricUnit":"","bestDirection":"lower"}
{"run":4,"commit":"217eb09","metric":1,"metrics":{"targeted_tests_passed":2,"full_tests_passed":212,"full_test_files_passed":29},"status":"keep","description":"Coalesce duplicate in-flight customer server-index searches","timestamp":1780245308785,"segment":3,"confidence":null,"asi":{"hypothesis":"Repeated identical CustomerPicker search calls can duplicate Convex query/action work while a previous server-index search is still in flight; coalescing by normalized query and owner filter reduces remote calls without caching stale customer data beyond the in-flight request.","verification":"run_experiment passed the customer server-index hook test plus typecheck/lint with METRIC customer_duplicate_remote_calls=1 for two concurrent equivalent searches; separate full suite passed 29 files / 212 tests and search:experiment help still works.","anti_overfit":"Only in-flight requests are coalesced; completed results are not persisted in the hook, so Feishu/Convex source-of-truth behavior for later searches remains unchanged.","caveat":"This measures duplicate-call suppression in a unit-level user-flow test rather than live p50/p95 on a deployment; the destructive Convex experiment still requires --destructive-ok on disposable/dev infrastructure."}}
{"type":"config","name":"Customer cache-miss Feishu payload reduction","metricName":"cache_miss_page_size","metricUnit":"","bestDirection":"lower"}
{"run":5,"commit":"31310b4","metric":50,"metrics":{"targeted_tests_passed":7,"full_tests_passed":213,"full_test_files_passed":29},"status":"keep","description":"Reduce Feishu page size for interactive customer cache-miss backfill","timestamp":1780245458106,"segment":4,"confidence":null,"asi":{"hypothesis":"Interactive customer cache misses should not fetch and upsert 500 Feishu rows when the picker displays at most 50; keeping full sync at page_size=500 while reducing searchAndCacheMiss to page_size=50 should reduce miss latency, payload, and Convex write fanout without harming normal mirror-hit correctness.","verification":"run_experiment passed customersMirror tests plus typecheck/lint with METRIC cache_miss_page_size=50; separate full suite passed 29 files / 213 tests and search:experiment help still works.","anti_overfit":"The change follows the product result limit and official Feishu page_size contract; it does not fake search results or skip Feishu on actual cache misses. Full sync still pages comprehensively at 500.","caveat":"A smaller first page can backfill fewer long-tail matches per miss; weekly full sync and later specific misses still populate the mirror. Live deployment p50/p95 remains to be measured on disposable/dev infrastructure."}}
{"type":"config","name":"Wire active Customer search hook to optimized implementations","metricName":"active_server_index_duplicate_calls","metricUnit":"","bestDirection":"lower"}
{"run":6,"commit":"7b8db6e","metric":1,"metrics":{"targeted_tests_passed":3},"status":"keep","description":"Wire active customer search hook to focused optimized server-index implementation","timestamp":1780245716057,"segment":5,"confidence":null,"asi":{"hypothesis":"Previous customer server-index optimizations lived in the focused useCustomerSearchServerIndex hook but the active composite hook still carried an older inline implementation; routing useCustomerSearch through the focused hooks makes the duplicate-search coalescing and mirror-kick throttling affect the actual RequestIntakeScreen path.","verification":"run_experiment passed useCustomerSearch + useCustomerSearchServerIndex tests plus typecheck/lint with METRIC active_server_index_duplicate_calls=1.","anti_overfit":"This changes hook composition so production mode uses the already-tested focused implementation; it does not alter benchmark data, fake search results, or skip Feishu/Convex source-of-truth paths.","caveat":"Full suite was not used for this log because unrelated pre-existing uncommitted bitable/requestSync/schema changes caused failures; those unrelated changes were temporarily excluded from this commit and restored afterward."}}
{"type":"config","name":"CustomerPicker server-search debounce","metricName":"customer_picker_server_calls","metricUnit":"","bestDirection":"lower"}
{"run":7,"commit":"5a9b5b4","metric":0,"metrics":{"customer_picker_server_calls":0},"status":"crash","description":"Attempted CustomerPicker server-search debounce but verification was blocked by unrelated dirty backend changes","timestamp":1780245913368,"segment":6,"confidence":null,"asi":{"hypothesis":"Debouncing CustomerPicker server fallback should collapse rapid keystrokes into one server search call.","rollback_reason":"run_experiment failed during typecheck because unrelated pre-existing dirty backend changes in requestSync/bitable/schema were present and broke generated API/type assumptions, not because of the CustomerPicker debounce patch itself.","next_action_hint":"Temporarily isolate or stash unrelated backend changes, reapply only the CustomerPicker debounce patch, then rerun targeted test + typecheck/lint before logging keep.","error_class":"dirty_worktree_interference"}}
{"run":8,"commit":"5a9b5b4","metric":0,"metrics":{"customer_picker_server_calls":0},"status":"crash","description":"CustomerPicker debounce rerun still blocked by dirty backend schema/emailRecord drift","timestamp":1780245972864,"segment":6,"confidence":null,"asi":{"hypothesis":"Debouncing CustomerPicker server fallback should collapse rapid keystrokes into one server search call.","rollback_reason":"run_experiment failed during typecheck because backend schema/emailRecord/requestSync state in the working tree/repo is inconsistent with generated API, outside the CustomerPicker debounce path.","next_action_hint":"Use a clean worktree or repair the unrelated backend schema/requestSync changes before running typecheck/lint-inclusive autoresearch for frontend debounce.","error_class":"dirty_or_inconsistent_backend_state"}}
{"type":"config","name":"Restore clean verification baseline","metricName":"typecheck_errors","metricUnit":"","bestDirection":"lower"}
{"run":9,"commit":"5a9b5b4","metric":0,"metrics":{"typecheck_errors":0},"status":"crash","description":"Verification-baseline repair attempt still blocked by unrelated bitable idempotency changes","timestamp":1780246098062,"segment":7,"confidence":null,"asi":{"hypothesis":"Restoring the accidentally committed requestSync drift should recover a clean verification baseline so future latency experiments are trustworthy.","rollback_reason":"run_experiment reached test phase after typecheck/lint, but failed because unrelated dirty bitable idempotency test/code changes expect client_token behavior not present in the current implementation.","next_action_hint":"Isolate all unrelated bitable/requestSync/email sync work from autoresearch or complete that migration separately before using full-suite gates.","error_class":"unrelated_dirty_test_failure"}}
{"type":"config","name":"CustomerPicker server-search debounce isolated","metricName":"customer_picker_server_calls","metricUnit":"","bestDirection":"lower"}
{"run":10,"commit":"5a9b5b4","metric":0,"metrics":{"customer_picker_server_calls":0},"status":"crash","description":"Isolated CustomerPicker debounce still blocked because HEAD contains bad requestSync drift","timestamp":1780246229505,"segment":8,"confidence":null,"asi":{"hypothesis":"Debouncing CustomerPicker server fallback should collapse rapid keystrokes into one server search call when unrelated dirty changes are isolated.","rollback_reason":"run_experiment failed at typecheck because the current HEAD already contains requestSync changes that reference uncommitted/generated email outbox APIs; isolating the working tree was not sufficient.","next_action_hint":"First repair HEAD by reverting accidental requestSync drift to the last known good implementation, then rerun debounce or other latency experiments.","error_class":"committed_baseline_typecheck_failure"}}
{"type":"config","name":"Restore requestSync verification baseline","metricName":"typecheck_errors","metricUnit":"","bestDirection":"lower"}
{"run":11,"commit":"c9b76c8","metric":0,"metrics":{"full_tests_passed":214,"full_test_files_passed":30},"status":"keep","description":"Restore clean verification baseline by removing accidental requestSync outbox drift","timestamp":1780246321188,"segment":9,"confidence":null,"asi":{"hypothesis":"A clean verification baseline is required before further search-latency iterations; removing the accidentally committed requestSync outbox drift restores typecheck/lint/full-test gates without touching search behavior.","verification":"run_experiment passed bun run typecheck, bun run lint, and bun run test with METRIC typecheck_errors=0; full suite passed 30 files / 214 tests.","anti_overfit":"This does not alter search code or benchmarks; it only restores consistency between requestSync, schema, and generated API so future latency experiments can be honestly verified.","caveat":"Unrelated outbox/idempotency work should be completed in a separate migration branch before reintroducing it."}}
{"type":"config","name":"CustomerPicker server-search debounce clean baseline","metricName":"customer_picker_server_calls","metricUnit":"","bestDirection":"lower"}
{"run":12,"commit":"f92febe","metric":0,"metrics":{"customer_picker_server_calls":0},"status":"crash","description":"CustomerPicker debounce hit max-lines lint guard","timestamp":1780271016270,"segment":10,"confidence":null,"asi":{"hypothesis":"Debouncing CustomerPicker server fallback should collapse rapid keystrokes into one server search call.","rollback_reason":"run_experiment passed the targeted test/typecheck portion but failed lint because CustomerPicker.tsx exceeded the repository max-lines rule after adding debounce test/code.","next_action_hint":"Reapply the debounce patch and either extract small helpers or update the file-level lint exception in line with existing CustomerPicker test conventions, then rerun the full gate.","error_class":"lint_max_lines"}}
{"run":13,"commit":"f18d4cb","metric":1,"metrics":{"customer_picker_server_calls":1,"full_tests_passed":221,"full_test_files_passed":30},"status":"keep","description":"Debounce CustomerPicker server fallback search calls","timestamp":1780271085543,"segment":10,"confidence":null,"asi":{"hypothesis":"Debouncing CustomerPicker server fallback should collapse rapid keystrokes into one server search call, reducing Convex query/action traffic and Feishu cache-miss pressure without changing search correctness.","verification":"run_experiment passed targeted CustomerPicker test, typecheck, lint, full test suite, and search:experiment help with METRIC customer_picker_server_calls=1; an extra full-suite check also passed 30 files / 221 tests.","anti_overfit":"The test simulates a real typing flow (n -> no -> novo) and asserts one server search with the final normalized query; local matches still short-circuit and Feishu/Convex source-of-truth paths are unchanged.","caveat":"This is a UI call reduction measurement, not a live p50/p95 deployment measurement. The previous crash in this segment reported metric 0 only because lint failed before a valid keep run, so it is not a real performance baseline."}}
{"type":"config","name":"Customer cache-miss Feishu field projection","metricName":"cache_miss_unbounded_field_fetch","metricUnit":"","bestDirection":"lower"}
{"run":14,"commit":"7ed9dc9","metric":0,"metrics":{"full_tests_passed":221,"full_test_files_passed":30},"status":"keep","description":"Project Feishu fields for interactive customer cache-miss search","timestamp":1780271208749,"segment":11,"confidence":null,"asi":{"hypothesis":"Interactive customer cache-miss search currently asks Feishu for full Bitable rows; adding the same official records/search field_names projection used by full sync should reduce response payload and parsing time without changing the CustomerRecord projection or source-of-truth behavior.","verification":"run_experiment passed customersMirror tests, typecheck, lint, and full test suite with METRIC cache_miss_unbounded_field_fetch=0; search:experiment help still works.","anti_overfit":"The test asserts the real Feishu request shape includes the needed projected fields rather than mocking faster results. No search results are skipped or fabricated; cache misses still call Feishu records/search.","caveat":"This is a request-payload reduction verified at the API boundary, not a live deployment p50/p95 measurement."}}
{"type":"config","name":"CustomerPicker short-query server guard","metricName":"short_query_server_calls","metricUnit":"","bestDirection":"lower"}
{"run":15,"commit":"ac3a27a","metric":0,"metrics":{"short_query_server_calls":0},"status":"crash","description":"Short-query CustomerPicker server guard blocked by ImportMetaEnv baseline type drift","timestamp":1780271327693,"segment":12,"confidence":null,"asi":{"hypothesis":"Avoiding server fallback for one-character CustomerPicker queries should reduce broad, low-quality cache-miss traffic while local matches still render immediately.","rollback_reason":"run_experiment passed the targeted CustomerPicker test but failed typecheck because ImportMetaEnv no longer included Vite DEV/MODE and CSS side-effect declarations; this is a baseline typing issue outside the short-query patch.","next_action_hint":"Repair vite-env declarations, then reapply /tmp/short-query-guard.patch and rerun the full gate.","error_class":"baseline_type_declarations"}}
{"run":16,"commit":"0fd81d6","metric":0,"metrics":{"short_query_server_calls":0,"full_tests_passed":222,"full_test_files_passed":30},"status":"keep","description":"Skip server fallback for one-character CustomerPicker queries","timestamp":1780271376506,"segment":12,"confidence":null,"asi":{"hypothesis":"Avoiding server fallback for one-character CustomerPicker queries should reduce broad, low-quality cache-miss traffic while local matches still render immediately and server search begins once the query is specific enough.","verification":"run_experiment passed targeted CustomerPicker test, typecheck, lint, full test suite, and search:experiment help with METRIC short_query_server_calls=0.","anti_overfit":"The test simulates a real one-character typing flow and verifies no server fallback call; it does not fake search results or skip server search for meaningful two-character-plus queries.","caveat":"This is a UI call guard measurement, not live p50/p95 deployment data."}}
{"type":"config","name":"Server-index short-query central guard","metricName":"server_index_short_query_remote_calls","metricUnit":"","bestDirection":"lower"}
{"run":17,"commit":"dbde892","metric":0,"metrics":{"server_index_short_query_remote_calls":0,"targeted_tests_passed":3,"full_tests_passed":223,"full_test_files_passed":30},"status":"keep","description":"Guard server-index customer search against one-character queries","timestamp":1780271550700,"segment":13,"confidence":null,"asi":{"hypothesis":"The CustomerPicker now suppresses one-character server fallback, but the server-index search adapter could still be called directly by other UI paths or future refactors; adding the same minimum-query guard at the adapter boundary prevents broad Convex mirror queries and cache-miss Feishu calls without changing meaningful two-character-plus searches.","verification":"run_experiment passed useCustomerSearchServerIndex tests, typecheck, lint, full test suite, and search:experiment help with METRIC server_index_short_query_remote_calls=0; full suite passed 30 files / 223 tests.","anti_overfit":"The test exercises the public hook API with a real one-character query and asserts no Convex query or cache-miss action is called; it does not fake results and leaves all two-character-plus search paths unchanged.","caveat":"This is a boundary call-reduction guard, not live p50/p95 deployment data."}}
{"type":"config","name":"Customer cache-miss action short-query guard","metricName":"cache_miss_short_query_feishu_calls","metricUnit":"","bestDirection":"lower"}
{"run":18,"commit":"797e737","metric":0,"metrics":{"cache_miss_short_query_feishu_calls":0,"targeted_tests_passed":8,"full_tests_passed":224,"full_test_files_passed":30},"status":"keep","description":"Guard customer cache-miss action against one-character Feishu searches","timestamp":1780271673313,"segment":14,"confidence":null,"asi":{"hypothesis":"The UI and server-index hook now suppress one-character searches, but the public cache-miss action could still be invoked directly or by future code paths; guarding the action itself prevents broad low-quality Feishu records/search calls and Convex mirror writes for one-character queries without changing meaningful two-character-plus searches.","verification":"run_experiment passed customersMirror tests, typecheck, lint, full test suite, and search:experiment help with METRIC cache_miss_short_query_feishu_calls=0; full suite passed 30 files / 224 tests.","anti_overfit":"The test calls the cache-miss action handler with a real one-character query and asserts no Feishu call or Convex mutation occurs; it leaves actual two-character-plus cache misses untouched and does not fake search results.","caveat":"This is a defensive API-boundary call reduction, not live deployment p50/p95 data."}}
{"type":"config","name":"Customer repeated empty-miss live-search suppression","metricName":"empty_miss_live_actions","metricUnit":"","bestDirection":"lower"}
