{"run":34,"commit":"bed0988","metric":1,"metrics":{"duplicate_match_email_convex_queries":1,"targeted_tests_passed":6,"full_tests_passed":241,"full_test_files_passed":33},"status":"keep","description":"Coalesce server-index matchEmail calls by domain while in flight","timestamp":1780273808783,"segment":28,"confidence":null,"asi":{"hypothesis":"Server-index matchEmail is domain-based, so concurrent direct calls for different local parts at the same domain can share one Convex matchByEmail query. In-flight coalescing by email domain should reduce duplicate Convex queries without caching stale matches after the request resolves.","verification":"run_experiment passed useCustomerSearchServerIndex tests, typecheck, lint, full test suite, and search:experiment help with METRIC duplicate_match_email_convex_queries=1; full suite passed 33 files / 241 tests.","anti_overfit":"The test exercises the public hook API with two concurrent valid emails at the same domain and verifies one Convex query and a shared promise. The coalescing is in-flight only, so later calls still go to the Convex mirror; no Customer results are fabricated.","caveat":"This is a hook-level duplicate-query suppression metric, not live Convex p50/p95 deployment data."}}
{"type":"config","name":"Customer preload short-query server guard","metricName":"preload_short_query_legacy_actions","metricUnit":"","bestDirection":"lower"}
{"run":35,"commit":"dd247b5","metric":0,"metrics":{"targeted_tests_passed":1},"status":"crash","description":"Customer preload short-query guard test used wrong legacy action shape","timestamp":1780273946224,"segment":29,"confidence":null,"asi":{"hypothesis":"The preload customer search adapter can be called directly with one-character input; adding the same two-character guard should avoid legacy server action calls for broad low-value queries.","rollback_reason":"run_experiment failed in the new targeted test because the positive-path mock returned an array while the real legacy action returns an object with a records field. The short-query guard itself passed its test; the positive-path test fixture shape was wrong.","next_action_hint":"Reapply /tmp/preload-short-query-guard.patch, update the positive-path mock to return { records: [...] }, and rerun full verification.","error_class":"test_fixture_shape_error"}}
{"run":36,"commit":"27387a2","metric":0,"metrics":{"preload_short_query_legacy_actions":0,"targeted_tests_passed":2,"full_tests_passed":243,"full_test_files_passed":34},"status":"keep","description":"Guard preload customer search against one-character legacy action calls","timestamp":1780274052885,"segment":29,"confidence":null,"asi":{"hypothesis":"The preload customer search adapter can be called directly with one-character input outside CustomerPicker; adding the same two-character guard should avoid legacy server action calls for broad low-value queries while preserving two-character-plus fallback behavior.","verification":"run_experiment passed useCustomerSearchPreload tests, typecheck, lint, full test suite, and search:experiment help with METRIC preload_short_query_legacy_actions=0; full suite passed 34 files / 243 tests.","anti_overfit":"The tests exercise the public preload hook API: one-character input returns empty without calling the legacy action, while a two-character query still calls the action with the normalized query and returns real action-shaped records. No search results are fabricated in production paths.","caveat":"A prior crash in this segment used a bad test fixture shape; this keep is the verified run for the intended metric."}}
{"type":"config","name":"CustomerPicker two-character local-hit duplicate scan removal","metricName":"two_char_local_hit_name_reads","metricUnit":"","bestDirection":"lower"}
{"run":37,"commit":"56f4769","metric":0,"metrics":{"targeted_tests_passed":15},"status":"crash","description":"CustomerPicker two-character local-hit scan test counted render reads","timestamp":1780314119852,"segment":30,"confidence":null,"asi":{"hypothesis":"For two-character CustomerPicker input with a local directory hit, the server-search guard does not need to perform its own local filter before the render-time filter already computes matches. Cancelling the pending debounced server fallback after render should avoid duplicate local scans while still preventing server calls when local matches exist.","rollback_reason":"run_experiment failed because the new test counted customer.name reads from both local filtering and normal option/accessibility rendering, yielding 102 instead of the intended 100 scan-only reads. Existing behavior tests otherwise passed, so this is a measurement fixture issue rather than an invalidating implementation result.","next_action_hint":"Reapply /tmp/two-char-local-hit-cancel.patch, change the measurement fixture to count a non-rendered match field such as accountNo/domain reads, and rerun full verification.","error_class":"test_metric_includes_render_reads"}}
{"type":"config","name":"CustomerPicker two-character local-hit duplicate scan removal","metricName":"two_char_local_hit_match_field_reads","metricUnit":"","bestDirection":"lower"}
{"run":38,"commit":"c1474a2","metric":100,"metrics":{"two_char_local_hit_match_field_reads":100,"targeted_tests_passed":16,"full_tests_passed":244,"full_test_files_passed":34},"status":"keep","description":"Cancel CustomerPicker server fallback using rendered local matches","timestamp":1780314183137,"segment":31,"confidence":null,"asi":{"hypothesis":"For two-character CustomerPicker input with a local directory hit, the server-search guard does not need to perform its own local filter before the render-time filter already computes matches. Scheduling the debounce first and cancelling it after render when local matches exist avoids duplicate local scans while still preventing server fallback when the local directory can answer.","verification":"run_experiment passed CustomerPicker tests, typecheck, lint, full test suite, and search:experiment help with METRIC two_char_local_hit_match_field_reads=100; full suite passed 34 files / 244 tests.","anti_overfit":"The test exercises the real CustomerPicker UI with 100 records and a two-character query whose only local hit is at the end of the directory. It counts reads of a non-rendered match field to isolate filtering work, verifies the local result is shown, and verifies the server search is not called. No customer results are fabricated and no server/Feishu source-of-truth behavior is weakened for no-match queries.","caveat":"This measures local scan work in a unit-level UI flow, not live browser p95 typing latency. The immediately prior crash in the archived metric segment counted normal rendering reads and was a measurement fixture issue."}}
{"type":"config","name":"CoworkerPicker production preview-filter skip","metricName":"coworker_short_query_preview_name_lowercase_calls","metricUnit":"","bestDirection":"lower"}
{"run":39,"commit":"86c0258","metric":0,"metrics":{"coworker_short_query_preview_name_lowercase_calls":0,"targeted_tests_passed":3,"full_tests_passed":245,"full_test_files_passed":34},"status":"keep","description":"Skip CoworkerPicker preview fixture filtering in production mode","timestamp":1780314271552,"segment":32,"confidence":null,"asi":{"hypothesis":"CoworkerPicker computes preview fixture matches before checking whether preview fixtures are enabled, so production one-character input still lowercases/scans all preview coworker names before the short-query remote guard returns. Moving preview filtering behind the usePreviewCoworkers branch removes that production-only UI work while preserving preview-harness behavior.","verification":"run_experiment passed CoworkerPicker tests, typecheck, lint, full test suite, and search:experiment help with METRIC coworker_short_query_preview_name_lowercase_calls=0; full suite passed 34 files / 245 tests.","anti_overfit":"The test exercises the real CoworkerPicker production path, counts only lowercasing of the known preview fixture names after the input element is already located, and verifies the coworker search hook is not called. The implementation still filters preview fixtures when usePreviewCoworkers is true and leaves real Feishu two-character-plus search behavior unchanged.","caveat":"This measures a small UI CPU guard in unit tests, not live browser p95 typing latency."}}
{"type":"config","name":"Customer preload duplicate in-flight legacy search coalescing","metricName":"duplicate_preload_legacy_actions","metricUnit":"","bestDirection":"lower"}
{"run":40,"commit":"7568107","metric":0,"metrics":{"targeted_tests_passed":2},"status":"crash","description":"Preload in-flight coalescing test asserted async wrapper promise identity","timestamp":1780314346717,"segment":33,"confidence":null,"asi":{"hypothesis":"The preload customer search adapter can receive duplicate direct searches for the same normalized query while the legacy action is still in flight; coalescing those calls should reduce duplicate legacy Convex action work without caching results after completion.","rollback_reason":"run_experiment failed because the new test asserted the two returned promises were referentially identical, but the async search callback wraps returned promises even while the implementation correctly coalesces the underlying legacy action call. The assertion was stricter than the optimization metric.","next_action_hint":"Reapply /tmp/preload-inflight-coalescing.patch and change the test to assert one legacy action call plus equal resolved results instead of promise identity, then rerun full verification.","error_class":"test_assertion_too_strict_async_identity"}}
{"type":"config","name":"Customer preload duplicate in-flight legacy search coalescing","metricName":"duplicate_preload_legacy_actions","metricUnit":"","bestDirection":"lower"}
{"run":41,"commit":"7568107","metric":0,"metrics":{"targeted_tests_passed":3},"status":"crash","description":"Preload in-flight coalescing hit require-await lint","timestamp":1780314383221,"segment":34,"confidence":null,"asi":{"hypothesis":"The preload customer search adapter can receive duplicate direct searches for the same normalized query while the legacy action is still in flight; coalescing those calls should reduce duplicate legacy Convex action work without caching results after completion.","rollback_reason":"run_experiment passed the targeted preload hook tests, but lint failed because the refactored search callback was still marked async even though it now returns tracked promises directly. The implementation intent is valid; the callback signature needs to drop async.","next_action_hint":"Reapply /tmp/preload-inflight-coalescing-v2.patch, remove the async keyword from the search callback, and rerun full verification.","error_class":"lint_require_await"}}
{"run":42,"commit":"7568107","metric":0,"metrics":{"targeted_tests_passed":2},"status":"crash","description":"Preload coalescing non-async guard returned raw array","timestamp":1780314434549,"segment":34,"confidence":null,"asi":{"hypothesis":"The preload customer search adapter can receive duplicate direct searches for the same normalized query while the legacy action is still in flight; coalescing those calls should reduce duplicate legacy Convex action work without caching results after completion.","rollback_reason":"After removing async to satisfy lint, the short-query guard still returned a raw [] instead of Promise.resolve([]), so the existing one-character test failed at the promise boundary. The coalescing test itself passed and showed one underlying legacy action call.","next_action_hint":"Reapply /tmp/preload-inflight-coalescing-v3.patch, change the short-query branch to return Promise.resolve([]), and rerun full verification.","error_class":"promise_contract_regression"}}
{"run":43,"commit":"0409e83","metric":1,"metrics":{"duplicate_preload_legacy_actions":1,"targeted_tests_passed":3,"full_tests_passed":246,"full_test_files_passed":34},"status":"keep","description":"Coalesce duplicate in-flight preload legacy customer searches","timestamp":1780314486817,"segment":34,"confidence":null,"asi":{"hypothesis":"The preload customer search adapter can receive duplicate direct searches for the same normalized query while the legacy action is still in flight; coalescing those calls should reduce duplicate legacy Convex action work without caching results after completion.","verification":"run_experiment passed useCustomerSearchPreload tests, typecheck, lint, full test suite, and search:experiment help with METRIC duplicate_preload_legacy_actions=1; full suite passed 34 files / 246 tests.","anti_overfit":"The test exercises the public preload hook API with two concurrent normalized-equivalent searches and a pending real legacy-action-shaped response. It verifies only one underlying action call and both callers receive the same resolved customer records. The cache is in-flight only and deletes on success or failure, so later searches still query the source-of-truth action.","caveat":"Two immediately prior crash logs in this metric segment recorded metric 0 before valid verification; those were assertion/contract failures, not real optimized baselines. This keep is the first verified run for the intended duplicate-action metric."}}
{"type":"config","name":"Customer preload owner-filter shared in-flight legacy search","metricName":"preload_owner_filter_duplicate_legacy_actions","metricUnit":"","bestDirection":"lower"}
{"run":44,"commit":"8ee3087","metric":1,"metrics":{"preload_owner_filter_duplicate_legacy_actions":1,"targeted_tests_passed":4,"full_tests_passed":247,"full_test_files_passed":34},"status":"keep","description":"Share preload in-flight legacy customer search across owner filters","timestamp":1780314580795,"segment":35,"confidence":null,"asi":{"hypothesis":"The preload legacy customer action returns unfiltered records and owner filtering happens client-side, so concurrent searches for the same normalized query with different owner filters can share one in-flight legacy action and filter the shared raw result per caller.","verification":"run_experiment passed useCustomerSearchPreload tests, typecheck, lint, full test suite, and search:experiment help with METRIC preload_owner_filter_duplicate_legacy_actions=1; full suite passed 34 files / 247 tests.","anti_overfit":"The test exercises the public preload hook API with simultaneous unfiltered and mine-filtered searches for the same query. It verifies one underlying legacy action call, preserves all-record results for the unfiltered caller, and preserves owner-filtered results for the mine caller. The shared cache is in-flight only and still deletes on action completion/failure.","caveat":"This is a hook-level duplicate-action suppression metric, not live Convex or browser p95 latency data."}}
{"type":"config","name":"Customer directory manual refresh cooldown","metricName":"duplicate_customer_directory_refresh_actions","metricUnit":"","bestDirection":"lower"}
{"run":45,"commit":"c5e4c3f","metric":1,"metrics":{"duplicate_customer_directory_refresh_actions":1,"targeted_tests_passed":1,"full_tests_passed":248,"full_test_files_passed":35},"status":"keep","description":"Throttle repeated manual Customer Directory refreshes","timestamp":1780315071301,"segment":36,"confidence":null,"asi":{"hypothesis":"In preload mode, opening the CustomerPicker triggers a full Customer Directory refresh. Repeated open/close cycles after the directory is already ready can otherwise call the legacy listCustomers action repeatedly; a short manual-refresh cooldown should reduce full Feishu Customer Table reads while leaving initial preload and cache-miss search freshness intact.","verification":"run_experiment passed useCustomerDirectory tests, typecheck, lint, full test suite, and search:experiment help with METRIC duplicate_customer_directory_refresh_actions=1; full suite passed 35 files / 248 tests.","anti_overfit":"The test exercises the real useCustomerDirectory hook: it lets initial preload complete, then calls refresh twice and verifies only one additional listCustomers action runs, followed by another cooldown-skipped refresh. The cooldown applies only when the cache is ready; errors can still be retried and in-flight refresh dedupe remains unchanged.","caveat":"This is a hook-level duplicate full-refresh suppression metric, not live Feishu p50/p95 data."}}
