{"run":19,"commit":"f3a4d62","metric":1,"metrics":{"empty_miss_live_actions":1,"targeted_tests_passed":4,"full_tests_passed":225,"full_test_files_passed":30},"status":"keep","description":"Suppress repeated empty customer live cache-miss actions","timestamp":1780271787496,"segment":15,"confidence":null,"asi":{"hypothesis":"Repeated searches for a query that returned no live Customer results can otherwise hit the Convex action and Feishu records/search every time because there is nothing to backfill into the mirror. Briefly remembering empty live misses after first rechecking the Convex mirror should reduce repeated action/Feishu work without hiding newly mirrored data.","verification":"run_experiment passed useCustomerSearchServerIndex tests, typecheck, lint, full test suite, and search:experiment help with METRIC empty_miss_live_actions=1; full suite passed 30 files / 225 tests.","anti_overfit":"The adapter still performs the Convex mirror query before suppressing the live action, so data warmed by full sync or another user can appear immediately. Only empty live results are remembered for a short 30s TTL; positive results clear the miss cache and source-of-truth paths remain unchanged.","caveat":"This reduces repeat empty-miss action/Feishu load in a hook-level flow; live p50/p95 remains deferred until disposable/dev deployment measurement."}}
{"type":"config","name":"Coworker short-query frontend guard","metricName":"coworker_short_query_remote_calls","metricUnit":"","bestDirection":"lower"}
{"run":20,"commit":"d9743d9","metric":0,"metrics":{"coworker_short_query_remote_calls":0,"targeted_tests_passed":5,"full_tests_passed":226,"full_test_files_passed":30},"status":"keep","description":"Skip remote coworker search for one-character queries","timestamp":1780271909686,"segment":16,"confidence":null,"asi":{"hypothesis":"Coworker Search Users calls for one-character queries are broad and low-value; adding the same two-character minimum at the coworker hook boundary should avoid Convex query/action work and Feishu round trips while keeping meaningful two-character-plus searches unchanged.","verification":"run_experiment passed useCoworkerSearch tests, typecheck, lint, full test suite, and search:experiment help with METRIC coworker_short_query_remote_calls=0; full suite passed 30 files / 226 tests.","anti_overfit":"The test exercises the public hook with a real one-character query and asserts neither the warm Convex cache query nor Feishu action fallback is called. No results are fabricated; preview/test fixtures remain local and normal two-character-plus Search Users calls are unchanged.","caveat":"This is a UI/hook boundary call-reduction metric, not live p50/p95 Feishu deployment data."}}
{"type":"config","name":"Coworker action short-query server guard","metricName":"coworker_action_short_query_remote_calls","metricUnit":"","bestDirection":"lower"}
{"run":21,"commit":"601acf3","metric":0,"metrics":{"coworker_action_short_query_remote_calls":0,"targeted_tests_passed":15,"full_tests_passed":227,"full_test_files_passed":30},"status":"keep","description":"Guard coworker search action against one-character queries","timestamp":1780272021255,"segment":17,"confidence":null,"asi":{"hypothesis":"The coworker hook now suppresses one-character remote searches, but the public Convex action could still be invoked directly or by future UI paths; enforcing the same two-character minimum in the action avoids token resolution, cache query/mutation work, and Feishu Search Users calls for broad low-value one-character input while preserving two-character-plus searches.","verification":"run_experiment passed convex/feishu/coworkers.test.ts, typecheck, lint, full test suite, and search:experiment help with METRIC coworker_action_short_query_remote_calls=0; full suite passed 30 files / 227 tests.","anti_overfit":"The test calls the actual action handler with a real one-character query and asserts no token resolution, cache query/mutation, or Feishu call occurs. It does not fabricate coworkers; normal two-character-plus Search Users paths and cache behavior are unchanged.","caveat":"This is a defensive API-boundary call-reduction measurement, not live Feishu p50/p95 deployment data."}}
{"type":"config","name":"Coworker warm-cache short-query query guard","metricName":"coworker_cached_short_query_db_reads","metricUnit":"","bestDirection":"lower"}
{"run":22,"commit":"51718ab","metric":0,"metrics":{"coworker_cached_short_query_db_reads":0,"targeted_tests_passed":16,"full_tests_passed":228,"full_test_files_passed":30},"status":"keep","description":"Guard coworker warm-cache query against one-character reads","timestamp":1780272139843,"segment":18,"confidence":null,"asi":{"hypothesis":"The coworker hook and action now suppress one-character searches, but the public warm-cache query could still be invoked directly or by future code paths; returning before session/cache reads for one-character input avoids unnecessary Convex DB work while preserving all two-character-plus warm-cache behavior.","verification":"run_experiment passed convex/feishu/coworkers.test.ts, typecheck, lint, full test suite, and search:experiment help with METRIC coworker_cached_short_query_db_reads=0; full suite passed 30 files / 228 tests.","anti_overfit":"The test calls the actual public query handler with a real one-character query and spies on the fake DB to assert no session or cache read occurs. It returns no synthetic coworkers and leaves authenticated two-character-plus cache lookup behavior unchanged.","caveat":"This is a defensive query-boundary DB-read reduction, not live p50/p95 deployment data."}}
{"type":"config","name":"Customer mirror public search short-query guard","metricName":"customer_mirror_short_query_index_reads","metricUnit":"","bestDirection":"lower"}
{"run":23,"commit":"f1321c0","metric":0,"metrics":{"customer_mirror_short_query_index_reads":0,"targeted_tests_passed":9,"full_tests_passed":229,"full_test_files_passed":30},"status":"keep","description":"Guard customer mirror public search against one-character index reads","timestamp":1780272298888,"segment":19,"confidence":null,"asi":{"hypothesis":"The UI, server-index hook, and cache-miss action already suppress one-character customer searches, but the public mirror search query could still be called directly or by future code paths; applying the same two-character boundary before the search-index query avoids broad low-value Convex search index reads while preserving mirroredAt and two-character-plus search behavior.","verification":"run_experiment passed convex/feishu/customersMirror.test.ts, typecheck, lint, full test suite, and search:experiment help with METRIC customer_mirror_short_query_index_reads=0; full suite passed 30 files / 229 tests.","anti_overfit":"The test calls the actual public query handler with a real one-character query and asserts the customers search-index path is not reached. It does not fabricate customers; normal two-character-plus mirror search and cache-miss source-of-truth paths are unchanged.","caveat":"This is a defensive query-boundary search-index-read reduction, not live p50/p95 deployment data."}}
{"type":"config","name":"CoworkerPicker short-query debounce guard","metricName":"coworker_picker_short_query_hook_calls","metricUnit":"","bestDirection":"lower"}
{"run":24,"commit":"ce030bd","metric":0,"metrics":{"coworker_picker_short_query_hook_calls":0,"targeted_tests_passed":2,"full_tests_passed":231,"full_test_files_passed":31},"status":"keep","description":"Skip CoworkerPicker debounce for one-character production queries","timestamp":1780272457357,"segment":20,"confidence":null,"asi":{"hypothesis":"After adding short-query guards in the coworker hook and Convex endpoints, CoworkerPicker still scheduled a debounce timer for one-character production input before the hook returned empty results. Clearing immediately and waiting until two characters avoids timer/hook overhead and stale result display while preserving preview fixtures and normal Feishu Search Users behavior.","verification":"run_experiment passed CoworkerPicker tests, typecheck, lint, full test suite, and search:experiment help with METRIC coworker_picker_short_query_hook_calls=0; full suite passed 31 files / 231 tests.","anti_overfit":"The test exercises the real CoworkerPicker UI with a one-character query and verifies no hook call or dropdown opens; it also verifies two-character queries still debounce and call the hook. No coworkers are fabricated and the Feishu source-of-truth path is unchanged.","caveat":"This is a UI timer/hook-call reduction and stale-result prevention, not live Feishu p50/p95 deployment data."}}
{"type":"config","name":"CustomerPicker local filter broad-match cap","metricName":"local_filter_records_scanned_for_broad_match","metricUnit":"","bestDirection":"lower"}
{"run":25,"commit":"ca9edf1","metric":8,"metrics":{"local_filter_records_scanned_for_broad_match":8,"targeted_tests_passed":14,"full_tests_passed":232,"full_test_files_passed":32},"status":"keep","description":"Cap CustomerPicker local filtering at displayed result count","timestamp":1780272625636,"segment":21,"confidence":null,"asi":{"hypothesis":"In preload mode, broad CustomerPicker queries can locally scan the entire Customer Directory even though the dropdown only renders the first eight options. Stopping local filtering once the visible result count is full should reduce taskpane CPU work for broad matches without changing visible results or server source-of-truth behavior.","verification":"run_experiment passed customerSearchHelpers + CustomerPicker tests, typecheck, lint, full test suite, and search:experiment help with METRIC local_filter_records_scanned_for_broad_match=8; full suite passed 32 files / 232 tests.","anti_overfit":"The helper test uses real matching CustomerRecord objects with observable name reads to verify early exit after the display cap. The no-match path still scans the directory to avoid hiding create-customer/server-fallback behavior, and server-index/Feishu source-of-truth paths are unchanged.","caveat":"This measures local CPU work for broad local matches, not live browser p95 typing latency."}}
{"type":"config","name":"CustomerPicker short-query dropdown guard","metricName":"customer_picker_short_query_empty_dropdowns","metricUnit":"","bestDirection":"lower"}
{"run":26,"commit":"6fc5131","metric":0,"metrics":{"customer_picker_short_query_empty_dropdowns":0,"targeted_tests_passed":14,"full_tests_passed":233,"full_test_files_passed":32},"status":"keep","description":"Keep CustomerPicker closed for one-character no-match queries","timestamp":1780272772172,"segment":22,"confidence":null,"asi":{"hypothesis":"After short-query server guards, CustomerPicker still opened an empty/create dropdown for one-character queries with no local matches. Keeping the dropdown closed until either local matches exist or the query is specific enough avoids unnecessary DOM/listbox work and prevents low-quality one-character create affordances while preserving immediate local matches.","verification":"run_experiment passed CustomerPicker tests, typecheck, lint, full test suite, and search:experiment help with METRIC customer_picker_short_query_empty_dropdowns=0; full suite passed 32 files / 233 tests.","anti_overfit":"The tests exercise real CustomerPicker UI for both sides of the boundary: one-character no-match stays closed/no server call, while a one-character local match still renders immediately. No search results are fabricated and two-character-plus server/create behavior remains unchanged.","caveat":"This is a UI DOM/affordance reduction, not live browser p95 typing latency data."}}
{"type":"config","name":"CustomerPicker short-query duplicate local scan removal","metricName":"short_query_customer_local_name_reads","metricUnit":"","bestDirection":"lower"}
{"run":27,"commit":"636e64d","metric":100,"metrics":{"short_query_customer_local_name_reads":100,"targeted_tests_passed":15,"full_tests_passed":234,"full_test_files_passed":32},"status":"keep","description":"Skip duplicate local scan in CustomerPicker short-query server guard","timestamp":1780272909271,"segment":23,"confidence":null,"asi":{"hypothesis":"For one-character CustomerPicker input, the server-search guard does not need to run its own local filter because rendering already computes local matches. Returning before the server-decision local filter should halve local scan work for one-character no-match queries while preserving immediate local matches and all two-character-plus server fallback behavior.","verification":"run_experiment passed CustomerPicker tests, typecheck, lint, full test suite, and search:experiment help with METRIC short_query_customer_local_name_reads=100; full suite passed 32 files / 234 tests.","anti_overfit":"The test exercises the real CustomerPicker UI with 100 observable Customer names and verifies exactly one render-time local scan for a one-character no-match query. A companion test still verifies one-character local matches render, and server/Feishu behavior remains gated at two characters.","caveat":"This measures local CPU/name-read work in a unit-level UI flow, not live browser p95 typing latency."}}
{"type":"config","name":"Customer auto-match invalid-email remote guard","metricName":"invalid_email_customer_remote_triggers","metricUnit":"","bestDirection":"lower"}
{"run":28,"commit":"f3bde06","metric":0,"metrics":{"invalid_email_customer_remote_triggers":0,"targeted_tests_passed":3,"full_tests_passed":237,"full_test_files_passed":33},"status":"keep","description":"Skip customer auto-match remote work for invalid email domains","timestamp":1780273123647,"segment":24,"confidence":null,"asi":{"hypothesis":"Customer auto-match only has a useful mirror match/refresh path when the client email has a valid domain. Guarding invalid or incomplete emails before matchEmail/triggerRefresh avoids unnecessary Convex mirror calls and mirror kicks while preserving valid-domain auto-match behavior.","verification":"run_experiment passed useCustomerAutoMatch tests, typecheck, lint, full test suite, and search:experiment help with METRIC invalid_email_customer_remote_triggers=0; full suite passed 33 files / 237 tests.","anti_overfit":"The tests exercise the real hook for no-domain, incomplete-domain, and valid-domain inputs. They assert invalid inputs do no remote trigger work while valid domains still call matchEmail and triggerRefresh; no Customer results are fabricated and source-of-truth paths remain unchanged.","caveat":"This is a remote-trigger suppression metric at hook level, not live Convex p50/p95 deployment data."}}
{"type":"config","name":"Customer auto-match same-domain remote coalescing","metricName":"same_domain_customer_match_email_calls","metricUnit":"","bestDirection":"lower"}
{"run":29,"commit":"a7bfec4","metric":1,"metrics":{"same_domain_customer_match_email_calls":1,"targeted_tests_passed":4,"full_tests_passed":238,"full_test_files_passed":33},"status":"keep","description":"Coalesce customer auto-match remote work by email domain","timestamp":1780273266885,"segment":25,"confidence":null,"asi":{"hypothesis":"Customer auto-match is domain-based, so editing only the email local part should not repeat matchEmail or triggerRefresh for the same domain. Remembering the attempted domain in the auto-match hook should reduce redundant Convex mirror match/refresh triggers while still trying again when the domain changes.","verification":"run_experiment passed useCustomerAutoMatch tests, typecheck, lint, full test suite, and search:experiment help with METRIC same_domain_customer_match_email_calls=1; full suite passed 33 files / 238 tests.","anti_overfit":"The test exercises the real hook by rerendering from buyer@example.com to accounts@example.com and verifies one remote match/refresh for the shared domain. The valid-domain test still proves initial remote work runs, and invalid-domain guards remain intact; no Customer results are fabricated.","caveat":"This is a hook-level remote-trigger coalescing metric, not live Convex p50/p95 deployment data."}}
{"type":"config","name":"Customer auto-match same-domain local scan coalescing","metricName":"same_domain_customer_local_domain_reads","metricUnit":"","bestDirection":"lower"}
{"run":30,"commit":"53a6f90","metric":0,"metrics":{"targeted_tests_passed":4},"status":"crash","description":"Customer auto-match local scan coalescing test expected dispatch stability too strictly","timestamp":1780273413813,"segment":26,"confidence":null,"asi":{"hypothesis":"Customer auto-match local directory matching is domain-based, so changing only the email local part should not rescan the directory for the same domain.","rollback_reason":"run_experiment failed in the new targeted test because the assertion also expected dispatch to be called only once; the current hook still dispatches during render on rerender even though the domain scan was successfully not repeated. The failure is in the overly broad test assertion, not the local-scan optimization itself.","next_action_hint":"Reapply /tmp/same-domain-local-scan.patch, narrow the test to the intended metric (domain reads stay at 100), and rerun the full gate.","error_class":"test_assertion_too_broad"}}
{"run":31,"commit":"53a6f90","metric":0,"metrics":{"targeted_tests_passed":5},"status":"crash","description":"Customer auto-match local scan coalescing hit unused test variable","timestamp":1780273484786,"segment":26,"confidence":null,"asi":{"hypothesis":"Customer auto-match local directory matching is domain-based, so changing only the email local part should not rescan the directory for the same domain.","rollback_reason":"The targeted test passed, but typecheck failed because the narrowed test left an unused dispatch binding. The implementation and intended metric were not invalidated.","next_action_hint":"Reapply /tmp/same-domain-local-scan-v2.patch, remove the unused dispatch binding, and rerun full verification.","error_class":"test_typecheck_unused_variable"}}
{"run":32,"commit":"7056893","metric":100,"metrics":{"same_domain_customer_local_domain_reads":100,"targeted_tests_passed":5,"full_tests_passed":239,"full_test_files_passed":33},"status":"keep","description":"Coalesce customer auto-match local directory scans by email domain","timestamp":1780273545497,"segment":26,"confidence":null,"asi":{"hypothesis":"Customer auto-match local directory matching is domain-based, so editing only the email local part should not rescan the directory for the same domain. Keying local auto-match by derived domain should reduce repeated directory scans while still rematching when the domain changes.","verification":"run_experiment passed useCustomerAutoMatch tests, typecheck, lint, full test suite, and search:experiment help with METRIC same_domain_customer_local_domain_reads=100; full suite passed 33 files / 239 tests.","anti_overfit":"The test uses 100 Customer records with observable domain reads and rerenders from buyer@example.com to accounts@example.com; reads stay at one full scan for the shared domain. No Customer results are fabricated, and domain changes still alter the dependency key and rematch normally.","caveat":"The two prior crash logs in this metric segment recorded metric 0 before valid verification and are not real performance baselines; this keep represents the first verified run for the intended metric."}}
{"type":"config","name":"Customer server-index matchEmail invalid-domain guard","metricName":"invalid_email_match_email_convex_queries","metricUnit":"","bestDirection":"lower"}
{"run":33,"commit":"fc868a6","metric":0,"metrics":{"invalid_email_match_email_convex_queries":0,"targeted_tests_passed":5,"full_tests_passed":240,"full_test_files_passed":33},"status":"keep","description":"Skip server-index matchEmail Convex queries for invalid email domains","timestamp":1780273666803,"segment":27,"confidence":null,"asi":{"hypothesis":"The auto-match hook now avoids invalid email domains, but the server-index matchEmail adapter could still be called directly with incomplete input such as buyer@. Guarding matchEmail at the hook boundary avoids unnecessary Convex matchByEmail queries while preserving valid-domain matching behavior.","verification":"run_experiment passed useCustomerSearchServerIndex tests, typecheck, lint, full test suite, and search:experiment help with METRIC invalid_email_match_email_convex_queries=0; full suite passed 33 files / 240 tests.","anti_overfit":"The test exercises the public server-index hook matchEmail API with an incomplete email domain and asserts no Convex query occurs. It does not fabricate matches; valid-domain matchEmail still delegates to the Convex mirror query.","caveat":"This is a defensive hook-boundary query suppression, not live Convex p50/p95 deployment data."}}
{"type":"config","name":"Customer server-index matchEmail in-flight coalescing","metricName":"duplicate_match_email_convex_queries","metricUnit":"","bestDirection":"lower"}
